[
  {
    "id": "dlg.demo.marek",
    "npc": "pan_marek",
    "register": "pan",
    "start": "a",
    "nodes": {
      "a": {
        "who": "pan_marek",
        "pl": "Słucham?",
        "ru": "Слушаю?",
        "choices": [
          { "pl": "Mała kawa, proszę.", "ok": true, "next": "b", "react": "happy" },
          { "pl": "Mała kava, proszę.", "ok": false, "errorTag": "R3", "next": "a", "react": "confused" }
        ]
      },
      "b": { "who": "pan_marek", "lesson": "demo.s01", "next": "c" },
      "c": { "who": "pan_marek", "do": [{ "line": "bobr.after_kawa" }, { "startLesson": "demo.boss" }], "end": true }
    }
  }
]
